{
  "app_id": "cy_knit_lx",
  "intro": "一、公司介绍蠡县晨源针织有限公司，是河北蠡县源头无缝螺纹袖口生产厂家，拥有 1000㎡自有厂区，团队人数 30 人，配置裁剪机 12 台、高速袖口机 50 台、普通袖口机 70 台等百余台无缝圆机设备，专业生产防护服袖口、羽绒服圆筒罗纹、工装罗口、裤脚下摆、罩衣袖口、手套袖口。 公司深耕针织罗纹辅料领域多年，日产数万件成品，现货充足，支持来样定制；搭建了自有生产、质检、跟单全流程团队，严格把控产品弹力与尺寸；依托北方产业带优势，产品性价比突出。已服务众多防护服企业、服装工厂、辅料批发商，大小订单均可承接，交期稳定，售后完善，支持实地验厂、索样洽谈合作。 公司已在 1688 认证实力商家工厂。",
  "products_services": "二、产品服务核心生产产品主打无缝螺纹袖口、圆筒罗纹袖口、防护服罗纹袖口、领口、校服罗文袖口、手套袖口，同时覆盖羽绒服圆筒罗纹、工装罗口、裤脚下摆、罩衣袖口等全品类针织罗纹辅料。核心服务类型现货批发：主流规格产品长期备有充足现货，现货订单可快速发货来样定制：支持非标尺寸、弹力、克重、款式的定制生产，兼顾小批量试单与大批量集采需求全流程配套：提供快速打样、专人跟单服务，可匹配服装厂流水线缝制的标准化生产需求",
  "advantages": "三、产品优势一、核心产品特点一体无缝圆筒工艺：圆机整体织造成型，无拼接缝、无硬棱，表面平整顺滑，不会摩擦刺激皮肤；收口密封性更好，防风防尘。弹力均匀、持久回弹：采用涤氨混纺纱线，松紧力度适中；反复拉伸不易松弛、不发飘，长期使用不易变大、变形。定型稳定，尺寸统一：成品高温预定型处理，缩水率可控；同批次尺寸误差小，适配服装厂标准化缝制，减少返工。布面整洁，瑕疵率低：选用全新原料织造，结点少、无油污，不易起毛起球；常规黑、灰色上色均匀，不易发白掉色。款式规格丰富：多种周长、高度、克重可选，支持标准现货尺寸，也可定制非标大小、松紧度。二、核心竞争优势工艺优势：无缝结构对比有缝罗纹，舒适度、密闭性更强，尤其适配防护类服饰的核心需求。成本优势：北方产业带自产自销，省去多层中间商环节，大批量采购价格竞争力突出，适配降本型订单需求。供货优势：自有上百台圆机设备，日产数万只成品；主流规格长期现货储备，急单可快速发货，大单交期有稳定保障。灵活适配优势：现货批发 + 来样定制双模式并行，小批量试单、大批量集采均可承接；可根据客户需求调整弹力、克重等核心参数。品控保障：成品逐批抽检外观、尺寸、弹力；大货严格按照确认样品生产，出现品质问题可及时协调售后方案。三、产品应用场景防护服饰领域：一次性 / 可重复使用防护服、隔离衣、医护工装弹力袖口，实现袖口收紧、阻隔防护。秋冬服装领域：羽绒服、棉服、冲锋衣无缝袖口、下摆、裤脚收口，实现防风锁温。劳保工装领域：工装外套、防尘服、机修工作服、罩衣罗纹收口，耐磨实用。针织成衣配套：休闲外套、童装、针织服饰圆筒领口、罗纹裤脚等辅料配件。",
  "trust": "四、品牌故事蠡县晨源针织有限公司是扎根河北蠡县的针织罗纹辅料源头生产企业，依托北方针织产业带的集群优势，始终聚焦无缝螺纹袖口等针织辅料的生产与优化，从自有厂区搭建、全流程织造设备配置，到生产、质检、跟单团队的完整搭建，始终以服装产业链的实际需求为核心，深耕无缝针织工艺的优化与产品品质的稳定把控，逐步形成了自产自销、现货批发 + 来样定制并行的成熟经营模式，服务于全国范围内的防护服企业、服装工厂、辅料批发商等各类客户，在针织罗纹辅料赛道积累了稳定的客户口碑与扎实的行业生产经验。五、用户痛点普通有缝罗纹存在拼接棱，磨皮肤，防护服密闭效果差袖口弹力差，拉伸后难以回弹，久穿松垮变大同批次尺寸参差不齐、缩水不稳定，服装厂缝制返工多劣质原料结点多、有油污，容易起毛、掉色泛白中间商层层加价，难以找到源头工厂，采购成本高旺季产能紧张，交期拖延，急单缺少现货补货样品品质很好，大货偷工减料，货不对版非标尺寸难定制，厂家起订门槛高，售后响应拖沓六、信任背书平台资质：认证 1688 实力商家工厂，平台官方资质认证，经营资质有保障生产实力：1000㎡自有厂房与全套织造设备，全流程自产自销，支持客户实地验厂行业经验：多年针织罗纹辅料织造经验，深耕无缝螺纹袖口核心品类，规模化产能可保障大单、急单稳定交付品控体系：标准化品控流程，执行封样生产制度，多层质检环节，严格把控产品尺寸、弹力与成品瑕疵率客户认可：长期服务防护服、羽绒服、劳保工厂与各地辅料贸易商，拥有大量稳定合作的长期客户售后保障：完善的售后体系，支持快速打样、专人全程跟单，品质问题可高效协调处理",
  "pain_points": [],
  "source": "docx:晨源针织知识库.docx"
}
