{
  "app_id": "rd_pharma_hb",
  "intro": "一、公司介绍河北仁丹药业有限公司成立于 2022 年 9 月，总部坐落于河北省沧州市献县经济开发区，是集研发、生产、销售于一体的全产业链现代化健康产业企业。公司注册资本1100万元，斥资 1.2 亿元打造占地 30.68 亩的智能化生产基地。公司地处华北腹地，交通便利，区位优势明显，依托优越的地理条件和完善的基础设施，致力于为客户提供高品质的产品和服务。",
  "products_services": "二、核心产品与服务核心主营产品创口贴医用退热贴膏药贴",
  "advantages": "三、产品核心优势创口贴：高弹柔韧材质、轻薄透气不闷肤、粘性温和牢固、防水防污，适配日常防护场景医用退热贴：物理降温、安全温和、水润凝胶、亲肤不刺激、干净卫生、独立包装膏药贴：膏体厚实、载药量足、通透舒缓、配方温和、粘性适中、可反复贴合",
  "trust": "四、信任背书公司始终坚持诚信经营、质量优先的发展方针，经第三方权威信用评估机构综合评审，获得多项权威信用荣誉资质：AAA 级企业信用等级AAA 重质量守信用企业AAA 诚信经营示范企业AAA 重服务守信用企业AAA 绿色消费积分信用认证企业守信营商示范企业企业品牌荣获五星级品牌口碑评价企业负责人获评诚信经理人上述权威信用认证，客观体现公司完善的经营管理体系、稳定可靠的产品质量管控能力与优良商业信誉。公司严格遵守行业规范，持续严控产品品质，具备良好履约保障，竭诚为广大客户提供稳定优质的产品与服务。",
  "pain_points": [],
  "source": "docx:仁丹药业知识库.docx"
}
